Status,Thought/Trend/Tool,Date,Name,Platforms,Caption,1st Comment,Format,Clip/file URL
Draft,Tool,10/17/2024,Clif-notes summaries,"Facebook, Instagram, Newsletter, YouTube",,,,https://riverside.fm/dashboard/editor/preview/274e9f25-f0b5-483c-958a-b89e473cd21d/66facace6538723602a575c0?share-token=81484b742e53a8ab2ec9&content-shared=recording-preview
Posted,Thought,10/17/2024,All teen problems fall into one of four categories,,,,,https://riverside.fm/shared/exported-clip/30469bf9512c0395125d
Draft,Tool,10/18/2024,Cognitive Behavioral Therapy for Teens,Newsletter,,,,https://riverside.fm/shared/exported-clip/bbec90835436558f3397
Draft,Trend,10/17/2024,TREND: Gamifying Education for Real-World Impact,,,,,
Draft,,,How to use your brain,Instagram,,,,https://riverside.fm/shared/exported-clip/33babeac9a7da481dae8